{
  "sku": "NGP-SHACPOH",
  "transaction": "update",
  "title": "Profile of Horace",
  "author": "Shackleton Bailey, D. R.",
  "publisher": "Harvard University Press",
  "publishPlace": "Cambridge, Massachusetts",
  "publishYear": "1982",
  "isbn": "9780674713253",
  "edition": "First Edition",
  "firstEdition": true,
  "signed": false,
  "binding": "Hardcover",
  "bindingType": "hard",
  "dustJacket": true,
  "jacketCondition": "Near Fine",
  "bookCondition": "Very Good",
  "size": "8vo",
  "language": "ENG",
  "subject": "Horace; Quintus Horatius Flaccus; classics; Latin literature; Latin poetry; classical scholarship; Roman poetry; literary criticism; Odes; Satires; Epistles; Epodes; Richard Bentley; textual criticism; Harvard University Press",
  "description": "First Harvard University Press edition, 1982; the copyright page carries no later printing statement. Red cloth hardcover with gilt spine lettering, in the original unclipped dust jacket. A clean, tight copy: boards square, bright and unmarked front and rear, gilt bright, text block white and unfoxed, jacket bright with only faint edge rubbing and no chips or tears. Light pencil brackets and marginal lines appear on scattered pages throughout the text; the text itself is unmarked, with no underlining, inscription, bookplate or ex-library marks. Includes the appendices on Horatiana and on Bentley and Horace, Latin texts, and indexes.",
  "price": 30,
  "currency": "USD",
  "quantity": 1,
  "photos": [
    "photos/NGP-SHACPOH/1.jpg",
    "photos/NGP-SHACPOH/2.jpg",
    "photos/NGP-SHACPOH/3.jpg",
    "photos/NGP-SHACPOH/4.jpg",
    "photos/NGP-SHACPOH/5.jpg",
    "photos/NGP-SHACPOH/6.jpg",
    "photos/NGP-SHACPOH/7.jpg",
    "photos/NGP-SHACPOH/8.jpg",
    "photos/NGP-SHACPOH/9.jpg",
    "photos/NGP-SHACPOH/10.jpg"
  ],
  "pricing": {
    "url": "https://www.abebooks.com/book-search/isbn/9780674713253/?bi=h&sortby=1",
    "method": "price set by seller ($30); comps retained for reference: average U.S./U.K./Canadian same-condition total (item + shipping), widened to +/-1 grade, was $11.99",
    "n_used": 4,
    "by_region": {
      "US": 4,
      "UK": 0,
      "CA": 0
    },
    "range_total": [
      8.31,
      18.57
    ],
    "raw_price": 11.99
  },
  "condition_points": [
    "dust jacket bright and unclipped, faint edge rubbing only, no chips or tears",
    "red cloth boards clean and square front and rear, corners unbumped, no fading",
    "gilt spine lettering bright, spine unfaded and uncocked",
    "text block white and clean, page edges unfoxed, binding tight and square",
    "light pencil brackets and marginal lines on scattered pages throughout (seen at pp. 2-3, 24-25, 105)",
    "no underlining of text, no ownership inscription, bookplate or ex-library marks"
  ],
  "not_seen_in_photos": [
    "outer rear panel of the dust jacket"
  ],
  "condition_notes_from_mark": "Dust jacket, cover, spine, and pages are all in excellent condition. Only light pencil markings in the margin of some pages.",
  "pushed_at": "2026-09-16T20:39:43+00:00"
}
