{
  "sku": "NGP-COMMTOOH",
  "transaction": "update",
  "title": "The Odes of Horace: A Critical Study",
  "author": "Commager, Steele",
  "publisher": "University of Oklahoma Press",
  "publishPlace": "Norman",
  "publishYear": "1995",
  "isbn": "9780806127293",
  "edition": "Oklahoma Paperbacks edition",
  "printing": "1st printing",
  "firstEdition": false,
  "signed": false,
  "inscriptionType": "",
  "illustrator": "",
  "binding": "Softcover",
  "bindingType": "soft",
  "dustJacket": false,
  "jacketCondition": "No Jacket",
  "bookCondition": "Very Good",
  "bookType": "",
  "size": "8vo",
  "language": "ENG",
  "subject": "classics; Latin literature; Horace; Odes; Carmina; Latin poetry; literary criticism; Roman poetry; Augustan Rome; Steele Commager; David Armstrong; Oklahoma Paperbacks",
  "description": "Oklahoma Paperbacks edition, first printing, 1995, of Steele Commager's 1962 Yale study, with a new foreword by David Armstrong. Trade paperback in glossy purple wrappers; no dust jacket, as issued. A very good copy: the lamination is rubbed and lightly chipped at the head and tail of the spine, with light surface scuffing to the wrappers, and the spine panel remains bright and unfaded. Text is clean and unmarked throughout and the binding is tight. Includes bibliographical references and index.",
  "price": 16,
  "currency": "USD",
  "quantity": 1,
  "photos": [
    "photos/NGP-COMMTOOH/1.jpg",
    "photos/NGP-COMMTOOH/2.jpg",
    "photos/NGP-COMMTOOH/3.jpg",
    "photos/NGP-COMMTOOH/4.jpg",
    "photos/NGP-COMMTOOH/5.jpg"
  ],
  "pricing": {
    "url": "https://www.abebooks.com/book-search/isbn/9780806127293/?bi=s&cond=vg&sortby=1",
    "method": "average U.S./U.K./Canadian same-condition total (item + shipping)",
    "n_used": 2,
    "by_region": {
      "US": 2,
      "UK": 0,
      "CA": 0
    },
    "range_total": [
      11.87,
      20.0
    ],
    "raw_price": 15.93
  },
  "condition_points": [
    "wrappers bright and unfaded",
    "lamination rubbed and lightly chipped at spine head and tail",
    "light surface scuffing to wrappers",
    "text clean and unmarked",
    "binding tight"
  ],
  "not_seen_in_photos": [
    "page edges",
    "interior pages beyond title and copyright pages"
  ],
  "condition_notes_from_mark": "Cover, spine, and text in very good condition, with only minor wear to cover, spine and broken, pages clean and unmarked.",
  "pushed_at": "2026-09-17T02:36:43+00:00"
}
