{
  "sku": "NGP-WOODRHET",
  "transaction": "update",
  "title": "Rhetoric in Classical Historiography: Four Studies",
  "author": "Woodman, A. J.",
  "publisher": "Areopagitica Press / Croom Helm",
  "publishPlace": "Portland, Oregon; London & Sydney",
  "publishYear": "1988",
  "isbn": "9780918400074",
  "edition": "First Edition",
  "firstEdition": true,
  "signed": false,
  "binding": "Hardcover",
  "bindingType": "hard",
  "dustJacket": true,
  "jacketCondition": "Near Fine",
  "bookCondition": "Very Good",
  "size": "8vo",
  "language": "ENG",
  "subject": "classics; classical studies; ancient history; historiography; rhetoric; Roman history; Greek history; Thucydides; Cicero; Sallust; Livy; Tacitus; Latin literature; Croom Helm; Areopagitica Press",
  "description": "First edition, 1988: the Areopagitica Press issue for the United States (ISBN 0-918400-07-4) of the Croom Helm printing, comprising Woodman's four studies on Thucydides, Cicero, Sallust and Livy, and Tacitus. Hardcover in black cloth with bright gilt lettering to the spine, in the original cream dust jacket, not price-clipped. A very good copy in a near fine dust jacket: the jacket is creased at the head but complete, with no chips or tears; the cloth at the head of the spine is lightly rubbed and beginning to fray, the upper corners are slightly bumped, and the top edge of the text block is lightly soiled along the joints. Internally clean and unmarked, with no inscription or bookplate, and the binding tight and square.",
  "price": 72,
  "currency": "USD",
  "quantity": 1,
  "photos": [
    "photos/NGP-WOODRHET/1.jpg",
    "photos/NGP-WOODRHET/2.jpg",
    "photos/NGP-WOODRHET/3.jpg",
    "photos/NGP-WOODRHET/4.jpg",
    "photos/NGP-WOODRHET/5.jpg",
    "photos/NGP-WOODRHET/6.jpg",
    "photos/NGP-WOODRHET/7.jpg",
    "photos/NGP-WOODRHET/8.jpg",
    "photos/NGP-WOODRHET/9.jpg",
    "photos/NGP-WOODRHET/10.jpg"
  ],
  "pricing": {
    "url": "https://www.abebooks.com/book-search/title/rhetoric-in-classical-historiography/author/woodman/used/?bi=h",
    "n_used": 3,
    "mean_total": 77.27,
    "min": 54.31,
    "max": 96.9,
    "method": "average of the buyer total (item + shipping) across US/UK sellers in the same condition, rounded to whole dollars",
    "note": "Mark set $72 for the split grade (Very Good book in a Near Fine jacket): the rule gives $67 from 2 same-grade comps at Very Good and $77 from 3 at Near Fine. Neither ISBN is indexed on AbeBooks; all comps come from the title/author search."
  },
  "condition_points": [
    "minor creasing to the dust jacket at the head, heaviest at the top of the front panel and the front flap fold",
    "dust jacket not price-clipped; no chips or tears; rear panel clean apart from a few faint specks",
    "cloth at the head of the spine lightly rubbed and just beginning to fray",
    "light grey soiling to the top edge of the text block, heaviest along the joints",
    "upper corners slightly bumped",
    "gilt spine lettering bright, spine unfaded",
    "boards clean, binding tight and square",
    "endpapers clean; no inscription, bookplate or owner's name",
    "text block clean, light toning to the edges"
  ],
  "not_seen_in_photos": [
    "interior pages beyond the title and copyright pages"
  ],
  "condition_notes_from_mark": "Near fine condition, minor creasing of dust jacket, and slightly bumped upper corners. After the second batch of photos, agreed to grade the book Very Good in a Near Fine jacket and list at $72.",
  "pushed_at": "2026-09-15T15:51:15+00:00"
}
