{
  "sku": "NGP-FEENGODS",
  "transaction": "add",
  "title": "The Gods in Epic: Poets and Critics of the Classical Tradition",
  "author": "Feeney, D. C.",
  "publisher": "Clarendon Press",
  "publishPlace": "Oxford",
  "publishYear": "1993",
  "isbn": "9780198149385",
  "edition": "Clarendon Paperbacks",
  "printing": "",
  "firstEdition": false,
  "signed": false,
  "inscriptionType": "",
  "illustrator": "",
  "binding": "Softcover",
  "bindingType": "soft",
  "dustJacket": false,
  "bookCondition": "Good",
  "bookType": "",
  "size": "8vo",
  "language": "ENG",
  "subject": "classics; classical studies; Latin literature; epic poetry; Greek religion; Roman religion; Virgil; Ovid; Lucan; Statius; Homer; Apollonius; literary criticism; Oxford Clarendon Press",
  "description": "Clarendon Paperbacks issue of Feeney's study of the role of the gods in the classical epic tradition, first published in 1991 and first issued in paperback by Oxford University Press in 1993. Trade paperback in the red pictorial wrappers; no dust jacket, as issued. The spine is creased from reading with light wear at the head, and the wrappers are lightly rubbed with a short crease and small nick at the head of the front panel. Scattered foxing to the fore-edge, a previous owner's name and date in ink on the half-title, and a previous reader's pencil brackets and marginal lines in the chapter on Ovid's Metamorphoses. Binding sound and the text complete and otherwise clean; includes bibliographical references and index.",
  "price": 43,
  "currency": "USD",
  "quantity": 1,
  "photos": [
    "photos/NGP-FEENGODS/1.jpg",
    "photos/NGP-FEENGODS/2.jpg",
    "photos/NGP-FEENGODS/3.jpg",
    "photos/NGP-FEENGODS/4.jpg",
    "photos/NGP-FEENGODS/5.jpg",
    "photos/NGP-FEENGODS/6.jpg",
    "photos/NGP-FEENGODS/7.jpg",
    "photos/NGP-FEENGODS/8.jpg",
    "photos/NGP-FEENGODS/9.jpg"
  ],
  "pricing": {
    "url": "https://www.abebooks.com/book-search/isbn/9780198149385/used/?bi=s",
    "n_used": 6,
    "mean_raw": 42.94,
    "median": 39.98,
    "min": 33.26,
    "max": 65.0,
    "method": "average item price excl. shipping, rounded; used softcover comps within 1 grade of Good; 4 'As new' copies dropped"
  },
  "condition_points": [
    "Wrappers bright and unfaded; red panels show no sunning and the spine lettering is crisp",
    "Spine creased from reading - several vertical crease lines down its length",
    "Crease and light wear at the head of the spine",
    "Short crease and a small nick at the head of the front panel, upper fore-corner; light edge rubbing",
    "A few faint dark surface marks to the rear panel",
    "Scattered foxing and light spotting across the fore-edge; edges lightly age-toned",
    "Previous owner's name and date in ink at the head of the half-title",
    "Previous reader's pencil brackets and vertical marginal lines in the Ovid chapter (pp. 210-211)",
    "Text complete and otherwise clean where shown; printing crisp",
    "Binding sound: opens flat with no cracking or gutter strain visible"
  ],
  "not_seen_in_photos": [
    "Inside covers and rear endpapers - further inscriptions or stamps would not show",
    "Top and bottom edges - shown only obliquely; spotting there is not fully assessable",
    "The rest of the text block - the full extent of the pencil marginalia is unknown"
  ],
  "condition_notes_from_mark": ""
}
