{
  "sku": "NGP-ZANKPOWE",
  "transaction": "update",
  "title": "The Power of Images in the Age of Augustus",
  "author": "Zanker, Paul",
  "publisher": "University of Michigan Press",
  "publishPlace": "Ann Arbor",
  "publishYear": "1990",
  "isbn": "9780472081240",
  "edition": "First Paperback Edition",
  "printing": "23rd printing",
  "firstEdition": false,
  "signed": false,
  "inscriptionType": "",
  "illustrator": "",
  "binding": "Softcover",
  "bindingType": "soft",
  "dustJacket": false,
  "jacketCondition": "No Jacket",
  "bookCondition": "As New",
  "bookType": "",
  "size": "Large 8vo",
  "language": "ENG",
  "subject": "Roman art; Roman archaeology; Augustus; Ancient Rome; classical studies; Jerome Lectures; art history; Roman architecture; Paul Zanker; Alan Shapiro",
  "description": "Jerome Lectures, Sixteenth Series. First paperback edition (1990) of Alan Shapiro's translation; a later printing, with the number line running down to 23. Trade paperback in glossy blue pictorial wrappers; no dust jacket, as issued. As new: wrappers bright and unmarked, corners square, spine uncreased, binding tight, text clean and unmarked; the only wear is a faint rub at the foot of the spine. Extensively illustrated with photographs of Augustan sculpture, coins, reliefs and architecture.",
  "price": 45,
  "currency": "USD",
  "quantity": 1,
  "photos": [
    "photos/NGP-ZANKPOWE/1.jpg",
    "photos/NGP-ZANKPOWE/2.jpg",
    "photos/NGP-ZANKPOWE/3.jpg",
    "photos/NGP-ZANKPOWE/4.jpg",
    "photos/NGP-ZANKPOWE/5.jpg"
  ],
  "pricing": {
    "url": "https://www.abebooks.com/book-search/isbn/9780472081240/used/?bi=s",
    "n_used": 12,
    "mean_total": 21.85,
    "median_total": 18.03,
    "min": 12.19,
    "max": 53.32,
    "method": "price set by Mark ($45); comps for reference: the only As New copy on AbeBooks totals $54.64 (US seller), and 12 US/UK softcover copies one grade down average $21.85 total (median $18.03, range $12.19-$53.32)"
  },
  "condition_points": [
    "wrappers bright and glossy, unmarked",
    "corners square and sharp",
    "spine uncreased",
    "faint rub at the foot of the spine",
    "binding tight",
    "text clean and unmarked where photographed",
    "no previous owner's marks seen"
  ],
  "not_seen_in_photos": [
    "page edges / fore-edge",
    "interior beyond title and copyright pages"
  ],
  "condition_notes_from_mark": "like new",
  "pushed_at": "2026-09-15T16:00:42+00:00"
}
