{
  "sku": "NGP-DOVEGH",
  "transaction": "update",
  "title": "Greek Homosexuality",
  "author": "Dover, K. J.",
  "publisher": "Vintage Books / Random House",
  "publishPlace": "New York",
  "publishYear": "1980",
  "isbn": "0394742249",
  "edition": "First Vintage Books Edition",
  "printing": "Feb 1980",
  "firstEdition": false,
  "signed": false,
  "binding": "Softcover",
  "bindingType": "soft",
  "dustJacket": false,
  "jacketCondition": "No Jacket",
  "bookCondition": "Very Good",
  "size": "8vo",
  "language": "ENG",
  "subject": "classical studies; ancient Greece; Greek history; homosexuality; sexuality; gender studies; LGBT history; intellectual history; Plato; Aristophanes; Greek vase painting; K. J. Dover; Vintage Books",
  "description": "First Vintage Books edition, February 1980, of Kenneth Dover's landmark 1978 study of homosexual behavior and sentiment among the ancient Greeks, drawing on vase painting, poetry, the lawcourts, Plato and Aristophanes; illustrated with plates of Attic vases. Trade paperback in pictorial wrappers; no dust jacket, as issued. Please note that the paper has yellowed heavily: the pages are toned a uniform deep yellow-tan throughout, as is common for this printing, though the text is clean and unmarked and the binding is tight and square. The covers are in very good condition, bright and clean, with only light rubbing, a shallow crease to the lower fore-corner of the front cover, a few small surface marks near the foot and lightly bumped corners; the spine is uncreased with the lettering unfaded. A very good copy with notably yellowed pages.",
  "price": 14.95,
  "currency": "USD",
  "quantity": 1,
  "photos": [
    "photos/NGP-DOVEGH/1.jpg",
    "photos/NGP-DOVEGH/2.jpg",
    "photos/NGP-DOVEGH/3.jpg",
    "photos/NGP-DOVEGH/4.jpg",
    "photos/NGP-DOVEGH/5.jpg"
  ],
  "pricing": {
    "url": "https://www.abebooks.com/book-search/isbn/0394742249/?bi=s&sortby=1",
    "method": "price set by Mark; comps: average U.S./U.K./Canadian same-condition total (item + shipping)",
    "n_used": 6,
    "by_region": {
      "US": 6,
      "UK": 0,
      "CA": 0
    },
    "range_total": [
      10.84,
      17.0
    ],
    "raw_price": 12.17
  },
  "condition_points": [
    "pages heavily yellowed/toned throughout (stated plainly in the listing)",
    "text clean and unmarked",
    "binding tight and square",
    "wrappers bright and clean, lightly rubbed",
    "shallow crease to lower fore-corner of front cover",
    "a few small surface marks near foot of front cover",
    "spine uncreased, lettering unfaded",
    "corners lightly bumped"
  ],
  "not_seen_in_photos": [
    "page edges",
    "endpapers",
    "body of the text block beyond the front matter"
  ],
  "condition_notes_from_mark": "The book cover is in very good condition, but the pages are very yellowed.",
  "pushed_at": "2026-09-16T15:44:40+00:00"
}
