{
  "sku": "NGP-GRANVI",
  "transaction": "update",
  "title": "Virgil's Iliad: An Essay on Epic Narrative",
  "author": "Gransden, K. W.",
  "publisher": "Cambridge University Press",
  "publishPlace": "Cambridge",
  "publishYear": "1991",
  "isbn": "9780521287562",
  "edition": "1991 reprint of the 1984 first ed.",
  "printing": "1991 reprint",
  "firstEdition": false,
  "signed": false,
  "inscriptionType": "",
  "illustrator": "",
  "binding": "Softcover",
  "bindingType": "soft",
  "dustJacket": false,
  "jacketCondition": "No Jacket",
  "bookCondition": "Very Good",
  "bookType": "",
  "size": "8vo",
  "language": "ENG",
  "subject": "Virgil; Aeneid; Homer; Iliad; epic poetry; classical studies; Latin literature; literary criticism; classics; Cambridge University Press",
  "description": "Cambridge University Press paperback, the 1991 reprint of the 1984 first edition. Trade softcover in navy laminated wrappers with yellow and cream lettering; issued without dust jacket. The wrappers show minor wear, with light rubbing and surface scuffing, a short crease near the head of the front cover, and slight discoloration along the top edge; the page edges are evenly toned. Spine uncreased and unbroken, binding tight, text clean and unmarked throughout. Gransden's study reads Aeneid VII-XII as a continuous epic narrative answering Homer's Iliad, and needs no Latin of its reader.",
  "price": 25,
  "currency": "USD",
  "quantity": 1,
  "photos": [
    "photos/NGP-GRANVI/1.jpg",
    "photos/NGP-GRANVI/2.jpg",
    "photos/NGP-GRANVI/3.jpg",
    "photos/NGP-GRANVI/4.jpg",
    "photos/NGP-GRANVI/5.jpg"
  ],
  "pricing": {
    "url": "https://www.abebooks.com/book-search/isbn/9780521287562/?bi=s&cond=vg&sortby=1",
    "method": "average U.S./U.K./Canadian same-condition total (item + shipping)",
    "n_used": 4,
    "by_region": {
      "US": 2,
      "UK": 2,
      "CA": 0
    },
    "range_total": [
      16.86,
      40.62
    ],
    "raw_price": 25.24
  },
  "condition_points": [
    "wrappers lightly rubbed with surface scuffing",
    "short crease near the head of the front cover",
    "minor discoloration along the top edge",
    "page edges evenly toned",
    "spine uncreased and unbroken, binding tight",
    "text clean and unmarked"
  ],
  "not_seen_in_photos": [
    "interior pages beyond the title and copyright pages",
    "rear free endpaper"
  ],
  "condition_notes_from_mark": "Cover spine and pages are in good condition, spine is unbroken, pages are clean, unmarked, but yellowed at the edges. Minor cover wear, and some minor discoloration on the top edge.",
  "pushed_at": "2026-09-17T02:05:10+00:00"
}
