{
  "sku": "NGP-HUTCGREE",
  "transaction": "add",
  "title": "Greek Lyric Poetry: A Commentary on Selected Larger Pieces",
  "author": "Hutchinson, G. O.",
  "publisher": "Oxford University Press",
  "publishPlace": "Oxford",
  "publishYear": "2003",
  "isbn": "9780199265824",
  "edition": "Paperback Edition",
  "firstEdition": false,
  "signed": false,
  "binding": "Softcover",
  "bindingType": "soft",
  "dustJacket": false,
  "jacketCondition": "No Jacket",
  "bookCondition": "Very Good",
  "size": "8vo",
  "language": "ENG",
  "subject": "Greek lyric poetry; classics; classical studies; ancient Greek literature; commentary; Alcman; Stesichorus; Sappho; Alcaeus; Ibycus; Anacreon; Simonides; Bacchylides; Pindar; Sophocles; Euripides; papyrology; textual criticism; Oxford University Press",
  "description": "Oxford University Press paperback issue (2003) of Hutchinson's commentary on the major pieces of Greek lyric, from Alcman to Simonides, with a large poem each from Bacchylides and Pindar and two odes from tragedy. Trade paperback in the publisher's glossy pictorial wrappers; no dust jacket, as issued. A very good copy: wrappers rubbed and lightly scratched overall, corners bumped and creased, small nicks to the spine ends and a light crease to the front joint. The spine is uncracked and the binding tight; the text block is clean, white and square, but there are pencil markings in the text and a pencilled list of page references, partly struck through, on the front blank leaf.",
  "price": 56,
  "currency": "USD",
  "quantity": 1,
  "photos": [
    "photos/NGP-HUTCGREE/1.jpg",
    "photos/NGP-HUTCGREE/2.jpg",
    "photos/NGP-HUTCGREE/3.jpg",
    "photos/NGP-HUTCGREE/4.jpg",
    "photos/NGP-HUTCGREE/5.jpg"
  ],
  "pricing": {
    "url": "https://www.abebooks.com/book-search/isbn/9780199265824/used/?bi=s",
    "n_used": 1,
    "mean_raw": 55.5,
    "min": 50.5,
    "max": 138.05,
    "method": "average buyer total (item + shipping) for US/UK sellers in the same grade, rounded; only 3 used copies listed worldwide"
  },
  "condition_points": [
    "wrappers rubbed and lightly scratched, gloss laminate scuffed on the rear panel",
    "corners bumped and creased",
    "small nicks/rubs to spine head and tail",
    "light crease to the front joint",
    "spine uncracked, lettering bright, binding tight",
    "text block clean, white and unfoxed",
    "pencilled list of page references, several struck through, on the front blank leaf",
    "pencil markings in the text (per Mark)"
  ],
  "not_seen_in_photos": [
    "title page and copyright page",
    "the pencil markings within the text itself",
    "top and bottom page edges"
  ],
  "condition_notes_from_mark": "Some wear to cover and bumped corners, but the spine is intact, pages like new, except for some pencil markings in the text."
}
